32,33,"초등학교때부터 굉장히 욕심이 많았던 학생이었습니다. 공부도 잘해야했고, 뭐든 다 잘해야 해서 어릴때 밤을 새며 완벽하게 하는 습관이 있었는데 4학년때 그 욕심이 깨지는 계기가 되었습니다 4학년때 내가 원했던 상을 타지 못했다는 이유로 선생님이 보는 앞에서 그 상장을 찢어버리고 집에 바로 갔던 기억이 있었습니다. 집에 가선 부모님한테 굉장히 혼이 났습니다. 제가 무얼 잘못한지는 알았는데 쉽게 인정할 수 없었던거 같습니다. 항상 최고만 했다가 내가 원하던 상장이 아닌 다른 상을 타는 순간  가슴이 내려앉는 기분이었습니다. 부모님은 저를 훈계하신 뒤, 세상이 항상 너 맘대로 되는건 아니라고 타이르셨습니다. 그 후로는 좀 유연해진 사고를 갖게 되었습니다 당연히 인간관계도 좋아졌다 볼 수 있고, 주변의 질투도 덜 받아서 편해지긴 했습니다. 다만 안타까운건 그 후로는 학습적인 부분에서 큰 욕심이 없어졌다는 점, 내인생을 좋은 운에 맡기는 습관이 생겼습니다. 하지만 나를 항상 지지해주고 이해해주는 소중한 가족이 있어서 뭐 아쉽진 않습니다. 현재는 노력한거에 비해 남들이 보기엔 팔자 좋은 삶?을 살고 있지만, 계속 운에만 의지하니 욕심 있는 친구들이 부러워지는 나이대가 되었습니다... 그래서 요즘은 다시 제 욕심을 가지려고 노력하는 중입니다. 또래에 비해 재테크 능력이 뛰어난 편이긴 합니다. 아무튼 학벌이나 직업으로는 원하는 바를 이루지 않았으나 , 다른 부분에서 만족된 삶을 만들어 꼭~~ 제 어릴적에 욕심대로 사는 사람이 되고 싶습니다. 물질적으로 엄청 풍요롭고 행복한 가정을 꾸리고 내조를 잘하고, 아이들에겐 좋은 엄마, 부모님께도 잘하는 효녀가 되는 것이 소망입니다. ",2.0
33,34,"평소 친구들을 좋아하고 술먹는 걸 좋아하던 저에게 여자친구가 한명 생겼습니다. 그 전에는 여자친구라는 개념이 그냥 같이 데이트하고 놀고 맛있는거 같이 먹는 이성 친구라고 생각하고 즐겨왔는데, 나이를 점점 먹게되고 언제까지 부모님밑에서 도움받으면서 살아야하나 라는 생각이 들면서 옆에 있는 여자친구와 인생을 꾸려나가봐야겠다는 생각이 정말 어느날 문득 들었습니다. 그 생각은 옆에 있는 여자친구를 만나면서 영향을 많이 받았습니다. 사귄지 4년정도 되었을 때 청약을 넣어왔던 것이 당첨이 되면서 여자친구와 결혼을 결심을 하게 되었습니다. 주변에는 아직도 철없고 노는거 좋아하는 친구들이 많아서 간혹가다 정신이 팔리기도 하지만 여자친구가 옆에서 열심히 도와주고 대화를 나누게 되면서 나 자신에게도 변화가 생기고 있음을 느끼고 있습니다. 집을 사게되면서 사정상 혼인신고를 먼저 하게 되었는데 이 혼인신고를 하면서 책임감이라는게 가슴 속에 와닿기 시작했습니다. 이제는 혼자가 아닌 둘이라는 매개체가 또 탄생했다는 생각에 가슴이 벅차고 흥분이 됩니다. 결혼준비를 하면서 자주 의견이 엇갈리고 여자친구가 화를 낼때마다 저는 너무 속상하고 그냥 내려놓고 여자친구의 뜻을 다 받아주고 있습니다. 제가 옆에서 도와줄 수 있는게 없는거 같아서 그게 제일 마음이 좋지 않고 제가 짐이 되는거 같이 느낄 때도 간혹 있습니다. 이런 계기들로 인해 제가 한층 더 성숙해져간다고 생각합니다. 이제 앞으로 더 많은 일들이 생길거 같은데 그럴때마다 저는 도를 닦는 기분으로 받아주고 가정을 지켜내보려고 합니다. 제가 나이를 더 먹고나서 30대인 저를 다시 돌아봤을 때 후회가 남지 않을 정도로 살아보고 싶습니다. 이 경험은 저를 상대방에게서 들어주고 믿어주고 지켜줄 수 있는 사람이라고 생각됩니다.",0.0
34,35," 내 모습, 다른 말고 내 성격을 나열해보자면 침착하고 차분하며, 화를 잘 내지 않는다.  또한 과묵해보이지만, 친해지면 말이 많다. 남들에게 친절한편이다. 맡은 일엔 책임을 다하려고하며 때로는 주도적으로 일을 해결하기도 한다. 그리고 감정을 잘 드러내지않고 표현하지않는다. 복잡하게 표현하는것보다 간단하게 표현한다.    나의 이러한 모습에는 전역 후에 했던 첫 연애가 가장 큰 영향을 미쳤다. 꽤 오랜기간 연애를 했다. 햇수로는 3년, 기간을 따지자면 1000일 정도. 상대방은 나쁜 사람이었다. 이기적이기도 했고, 변덕이 심하기도 했다.    난 싸우고 싶지 않았기 때문에 내가 양보하고 이해해야했다. 연애를 하기 전에도, 군생활을 하며 참을성을 많이 길렀기 때문에 참는건 어렵지 않았다. 하지만 화를 내지 않는게 어려웠다. 싸우지 않으려면 화를 내지 않아야했다. 화를 내는 순간 싸울수 있다고 생각했기 때문이다. 그녀는 잘못을 해도 사과하지않고 반성하지 않는 성격이어서, 내가 참아야했다. 계속 참다보니 그녀의 행동도 무덤덤해졌다. 화를 내지 않고 참는게 일상이 되어버렸다.   난 '해탈했다'라고 표현한다. 그녀와의 연애 덕분에 웬만한 일에는 무덤덤하게 반응할 수 있게 됐다. 연애를 하면서도 그렇고, 지인들과의 생활, 가족들, 업무적인 일들 등 내 생활과 관련된 전반적인 것들에서 예민하지 않게 반응한다. 그래서 성격이 좋다는 말을 많이 듣는다. 둥글게 둥글게 생각하고 넘어가기 때문이다. 또한 갈등 중재를 하기도 해서 사람들에게 신뢰를 받고 믿음직하다는 평가를 받기도한다. ",3.0
35,36,"나의 유년기. 많은 형제들중 늦둥이로 태어났고  가난한 늙은 농부의 자식이였고  부모님들은 아이들을 돌볼 여력이 없으셨어요 물도 나오지 않고 전기도 들어오지 않는 집에서 자랐고 나는 씻을 수 도없었고 화장실도 없었어요. 때가 온몸을 덮어서 몸이 씨커맸고 신체검사를 하기위해 벗겨진내몸을 보고 웃는 아이들 그때 그 감정은 죽고싶다.. 너무 부끄럽고 창피하다.. 머리에는 이가있었고 수업시간에 머리에 이가 기어다닌다고 비난하는 선생님과 구경하는 아이들,  너무 부끄러웠지만 나 스스로는 그 무엇도 할 수 없는 현실... 집에 돌아와도 나를 반겨주는이는 하나없었고 동네사람들의 수군거림 , 마을에 피해만 주고 민폐만 끼치는 우리집이 너무 싫어 떠나고 싶었지만 난 아무것도 할 수 없는 작은 꼬마...   나에게는 피해의식이 있고 자존감이 낮으며 늘 부정적인 생각을 하는 사람이 되었습니다. 누가 나에게 베푸는 호의가 부담스럽고 누구를 챙기는게 힘들고, 어느 누구와 깊은 관계맺기가 어렵습니다. 그게 편하기도 하지만 불편할때가 더 많습니다.   제대로된 양육을 받지 못한 나는 어른이 되어 아이를 낳았지만 사랑받고 관심받고 자라지 못한 나는 아이에게도 줄 수 있는게 아무것도 없었습니다. 육아서를 보고 익혔으면 좋았겠지만 그 노력도 하지 않았고 나의 자녀는 부모의 관심이 받고싶었지만 그렇지 못해 애정결핍이 왔고  지금 아이는 놀이치료를 받고  사회성치료를 받고 있습니다.  나는 내 자녀가 타인에게 피해주는게 너무싫고 다른사람 입에 오느내리는게 싫은데 내 자녀는 내가 싫어하는 모든일을 하고있고 그에대한 사과는 나의몫 그게 너무 힘들고 싫지만 아이를 위해 어쩔 수 없이 해야하고 그게 너무 스트레스입니다.   나는 현재  어두운 유년기에서 벗어나지 못하고 내아이와 나를 분리하지못해 내 아이도 왕따를 당하거나 손가락질을 받을까 늘 전전긍긍하며  살얼음판 걷는 기분으로 살아갑니다.   나는 아직도 힘없고 아무것도 할 수 없는 꼬마에 머물러있는거 같습니다.",1.0
36,37,"내가 생각하는 나의 성격은 다분히 이중적이다. 그렇지만 언뜻보기에 나는 참 따뜻한 사람이다. 교우관계에서도 사회생활에서도 나는 언제나 '착하고 다정하고 모든 사람들을 친절하게 도와주며 포용적인 사람'으로 기억될만한 행동을 해왔고, 실제로 사람들도 그렇게 말했다. 친구들은 나에게 마치 언제나 씩씩하게 힘내고 친절하고 다정한 '캔디'같은 친구라고 했다. 나도 내가 그런 줄 알았고. 그런 내가 처음으로 인간관계에서의 나의 성격에 대해 깊게 생각해본것은, 의외로 나의 가족에 대한 경험때문이다.우리가족은 내가 중학교때부터 할머니와 함께 살게되었다. 학교에서 모든 친구들에게, 그리고 모든 선생님에게 그토록 착하고 다정한 내가, 왜인지 집에 계신 할머니에게는 다정하지 못했다. 물론 처음에는 다정하려고 노력했다. 하지만 같이 지낸 기간이 10여년정도 되갈수록, 나는 할머니를 진정한 우리 가족이 아니라 우리 엄마가 힘들게 모시고 사는 분이라고 생각하게되었나보다. 물론 엄마의 힘겨운, 굴곡진 인생사도 거기에 한몫하긴 했다. 나보다 다른 손자손녀들을 더 사랑하는 할머니의 모습을 보았기때문일수도 있고. 어쨌든 어느순간부터 나는 할머니에게 다정하지 못했고, 다정한 말을 건네지 못했다. 물론 가능한 티내지 않으려했지만, 할머니는 물론 그것을 느끼셨을꺼고, 우리의 관계는 건강한 할머니와 손녀와의 관계가 되지 못했다. 그리고 어느날 할머니가 나에게 말씀하시길 '너는 참 냉정하다'라고 하셨다. 부연설명없는 딱 한마디였지만 그말은 아마 평생 잊지못할거다. 지금도 그 말을 들었던 그때의 말투와 분위기가 생생하게 기억나니까. 언제나 다른사람에게 착한 사람이던 내가, 처음으로 냉정하다라는 말을 들은게 내 가족으로부터라니. 아마 그때부터 니는 내가 생각보나 나쁜 사람일 수 있다는 생각을 했던거 같다. 물론 성인이 된 지금은 모든 사람에게 어느정도는 이중적인 모습이 있을 수 있다고 생각한다. 하지만 내가 그렇게 완벽하게 선한사람이 아니고, 그런 나의 다른 성격 역시 내가 포용하면서 살아가야할 부분이라고 생각한다. 어찌보면 슬프지만, 어찌보면 인간관계를 더 편하게 할 수 있는, 난 그런 어른이 되어갔다. ",4.0
37,38,"2016년 3월정도로 기억되요.  남푠이 순대국 먹고 싶다고 해서 사무실로 저를 태우러 온뒤 순대국집 가는  도중에 교통사고가 났어요. 노은동 월드컵경기장역 사거리였는데 저희가 노은역쪽으로 갈수 있는 신호였죠.  근데 신호를 잘못본 가해자가 직진을 하는 바람에 사고가 났어요. 가해자 100프로 과실 사고였죠. 사고는 참 많은것들이 변하게 하더라 구요.  보상을 받았지만 투잡을 하고 있었던 남편은 더 이상 투잡을 할수 없었고, 약간의 보상으로 해결이 되지않는 현실,  참 막막했지요.  적금,보험을 1000만원이상 깨서 차할부금도 값고, 부족한 생활비로 충당했어요. 하지만 딱 1년이더라구요.  남푠이 용돈을 달라고 하네요. 그래서 더이상은 안된다고 했어요.  카드 펑크나서 안된다고 그제서야 남푠이 현실을 인지하더라구요. 제가 사고가 난뒤에 돈이 많이 부족해지기 시작해서 네이버 카페활동을 시작, 어떻게 하면 돈을 아껴쓸수 있을까 해서요. 흥부야 재테크하자,짠돌이부자되기,월급쟁이 재테크카페에 가입해서 활동을 시작했는데 인기10인이 되는것도, 이벤트 참여해서 상을타는 것을 보게 되었어요. 우와 하면서 저도 인기10인이 되야지 했구, 도전 성공했어요.  인기10인이 되니 이벤트 참여해서 상도 타야겠다 맘먹었죠.  정말 열심히 했어요.  하다보니 상도 타게 되더라구요.  가끔 베스트글 도전을 하고 있어요.  예전이라면 할 수 없었던 일이죠.  저는 사실 글을 잘 못써요.  근데 저를 인정해 주기 떄문에 상을 준다고 생각해요. 카페활동을 하면서 제일 기억에 남는분은 흥부야 재테크하자의 많이먹자님이에요.  이분은 정말 모르는게 없어요. 이분한테 썸뱅크,티라이프,카드혜택등 정말 많이 배웠고 앞으로도 배울꺼에요.  공돈모으기하고 있는데 이분이 있어서 일취월장 할 수 있었죠.  카페활동을 하면서 정보를 접하는데 다른 사람들보다 빨리 습득을 했어요.  그게 정말 신이난 저는 정말 열심히 카페활동을 했지요.  열심히 하는 많큼 상도 많이 탈수 있었구요.  카페활동이 싫증이 날떄도 있었지만 꾸준히 활동하고 있지요 카페활동을 꾸준히 한 덕분에 식비를 많이 줄일수 있었구, 냉장고 파먹기를 하다보니 시켜먹는 음식도 많이 줄어 들었어요.  앞으로도 열심히 카페활동해서 공돈도 모으고 생활비도 열심히 줄여갈거랍니다.  읽어주셔서 감사합니다.",2.0
38,39,"저는 태어나면서부터 극심한 아토피환자였습니다. 사춘기에는 대학병원에 다니며 치료를 받아야 했고, 극심한 부작용과 각종 합병증으로 중학교 때 일찌감치 나이 40 이후에는 삶을 마감해야겠다고 결심할 정도였습니다.   아토피 환자로 살면 생각보다 아주 사소한 많은 '평범하고 흔한'일들을 하기가 어렵습니다. 예를 들어 여름에 더우니까 반팔 셔츠를 입는 것도 불가능합니다. 피부가 찢어지거나 두드러기와 각질이 올라오거나 모습이 몹시 흉측해질 수 있으니까요. 게다가 이 질병으로 저는 10대 시절 끔찍한 왕따를 경험하기도 했습니다. 이 병은 한참 성장하는 10대 소녀를 무참하게 짓밟고 20대에는 가장 흉측한 외모를 가지게 해 주었을 뿐 아니라, 정신마저도 갉아먹히는 고통을 느끼게 했습니다.   아이러니하게도, 이 병 때문에 저는 꽤 많은 소중한 것을 얻게 되었습니다. 늘 내가 누구인지, 내가 얼마나 사랑받는 사람인지를 깨닫게 해 준 가족과 겉모습이 아닌 내면을 보아 주고 지금까지 평생을 이어져 온 친구들이 있습니다. 집에서 혼자서 꾸준히 즐기던 음악으로 취미생활을 오래 깊게 하다 보니 입시레슨을 받아본 적도 없는데 음악대학원을 합격하기도 했고요. 그 외 여러가지가 있지만 가장 인상적인 것은, 그 긴 고통의 시간이 저라는 사람을 아주 적나라하게 마주하는 기나긴 사투의 시간을 경험할 수 있었다는 것입니다. 내가 누구인지, 내가 무슨 생각을 하는지, 내가 무엇을 바라는지를 미사여구 없이 솔직하게 일기를 써내려가면서, 벌거벗은 듯한 느낌이 들곤 했습니다. 특이한 점은, 그 과정에서 제가 특별한 삶의 목표를 찾았기 때문에 마음이 편해진 것이 아니라 제가 누구인지를 좀 더 분명히 확인했기 때문이라는 것입니다. 그랬기 때문에 저는 병 때문에 매일 괴로워하고 슬퍼하면서도 거기에 지쳐 쓰러지지 않을 수 있었다고 생각합니다. 그리고 그랬기 때문에 그렇게 살아가는 중에도 음악대학원과 직장생활, 해외 유학 등의 여러 과제를 수행해낼 수 있었을 거라고 봅니다. (종교에는 전혀 의지하지 않았습니다.)  정말 우연히 (아마도 운이 좋아서) 서서히 병이 낫게 되어 지금은 아주 편안하고 정상적인 삶을 유지하는 지금, 저는 정말 행복합니다. 그 전에 할 수 없었던 사소하고 흔한 일들을 고통스럽지 않게 할 수 있다는 것, 평범하게 직장을 가지고 목표를 가지고 결혼을 하며 사랑하며 살 수 있다는 것 등등 이 모든 것이 감사하고 기쁘게 느껴집니다. 저는 아마도 저를 죽을만큼 괴롭혔던 것이 남긴 유산에 의지해서 살아가는 사람이 아닐까 생각이 들기도 합니다. ",3.0
39,40, 어릴적부터 남들과는 다른 생각으로 자기 주장이 강한편이었으나 그로 인해 교우 관계가 원만해지지 못하게 되었고 그로 인해서 다툼이 많이 있던 편이었습니다. 그 결과 나보다는 남들이 말이 더 중요하다고 생각되면서 내 생각을 말하되 강하게 주장을 못하고 남이 하는 말에대해서 좌지 우지 흔들리는 경향이 있게 되었습니다. 그로 인해 직장을 구하는 것도 주변 사람들이 눈치를 보면서 구하게 되고 의사 결정을 함에 있어서도 부모님의 눈치 또한 많이 보게 되었습니다.  그로 인하여 주변에서는 남들의 말을 잘 듣고 남들을 위해서 활발하고 유쾌한 사람 내지는 좋은 사람의 평을 많이 듣게는 되지만 정작 내가 누구인지.. 내 원래 모습은 어떤 모습인지 생각하는게 많아지고 내가 지금 원래 내가 생각했던 나의 모습을 보이면 다시 과거처럼 주변에서 도태되지는 않을까.. 하는 걱정이 많이지게 되었습니다. 그리하여 주변의 시선 주변의 반응들 위주로 생활을 오래 하다보니 이제는 반대로 내 자신의 존재가 너무 작아지고 내 존재의 의미가 없어지는 것 같아서 이제는 다시 내가 나임을 밝히고 이런 나라도 좋아해 줄 수 있는 사람 이런 나라도 함께 있어주려하는 사람들과 함께 가고 싶다라는 생각을 하게 되고 행동 또한 어느 정도 내 사람이라는 생각이 들면 그 뒤로는 제 주장을 더 강하게 피고 고집하는 부분이 생기게 되었습니다.    ,0.0
40,41,"    중학교 3학년 때 토익 학원을 다녔습니다. 새로운 사람도 많이 만나고 선생님들도 친절하게 잘 가르쳐주시고 무엇보다 처음 수강해본 회화수업이 재미있어서 이른 오후에 나간 날에도 저녁 늦게 끝나는 직장인 반 수업까지 듣고 오곤 했습니다. 가끔은 직장인 분들과 함께 맛있는 음식을 먹기도 했습니다. 그러면서 직장인 분들과 꽤 친해지게 되었고, 그분들이 살아가는 이야기를 들을 기회가 많았습니다. 새벽 6시에 일어나서 8시까지 출근하고 바쁘게 일하다가 6시에 퇴근하면, 집으로 가서 쉬는 게 아니라 살아남기 위해서 영어학원으로 와야 하는 생활... 정말 대충 살아가고 있었던 제게 그분들의 이야기는 충격적이었습니다. '대충 살아서는 안 되겠구나...', '잘못 살고 있었구나...'라는 생각들이 들었고, 단순히 게임하고 놀고 먹고 자는 데만 적극적인 태도를 취할 게 아니라 삶 전반에 있어서 적극적인 태도를 취해야 겠다고 다짐했습니다. 그리고 고등학교에 입학한 이후에는 전교 1등을 목표로 열심히 공부했습니다. 돌이켜 보면 '살아남아야 겠다'라는 생각에 사로잡혀있었던 것 같습니다.      첫 번째로, 저는 공감을 잘 합니다. 직장인 분들의 이야기에 잘 공감했기에 제 삶에서 변화가 일어날 수 있었다고 생각합니다. 두 번째로, 저는 사람을 잘 따르는 편입니다. 직장인 분들에게 큰 재미를 주는 사람은 아니었지만 그들을 잘 따르고 그들에게 귀여움을 받는 사람이었습니다. 세 번째로, 저는 욕심이 있는 사람입니다. 어떠한 목표를 설정하고 그것을 이뤄내고자 노력하는 태도는 욕심 없이는 불가능하다고 생각합니다. 네 번째로, 저는 성실한 사람입니다. 학원에서 매일 오랜 시간 수업을 열심히 들을 수 있었던 것도 제가 성실하기에 가능했고, 고등학교 이후로 공부에 매진할 수 있었던 것도 제가 성실했기에 가능했습니다. 다섯 번째로, 저는 제가 즐길 수 없는 것들은 정말로 잘 하지 않는 성격입니다. 학교 공부에는 소홀했으면서도 토익 학원을 열심히 다녔던 것은 제가 호불호가 확실하고 제가 좋아하는 것은 열심히 하지만 제가 좋아하지 않는 것은 전혀 할 생각이 없는 사람이기 때문입니다.  ",4.0
41,42,"학창시절에 또래에 비해서 키가 작고 여드름도 많고 살이 쪄서, 외모에 대해서 자격지심이 있었다. 그래서 외모에 신경을 많이 쓰게 되었고, 집 앞 슈퍼를 가더라도 항상 옷을 갈아입고 세수와 머리를 감은 뒤에 나갔다. 남들과도 비교를 많이 했다. 어린 마음에 작은키에 어울리지 않는 다리털 또한 컴플렉스여서 그 더운 날에도 반바지는 집 아니면 학교 체육시간만 입고 다녔다. 부모님을 비롯한 가족들은 심하다 싶을 정도로 남들의 눈을 의식하는 날 보고 이해할 수 없다고 했고, 나 또한 가족들을 이해할 수 없었다. 그렇게 살다보니 내 스스로에게 제약을 거는 것들이 너무나 많아졌다. 그즈음 학원을 다니다 알게된 여자애에게 관심이 가기 시작하면서, 그 애에게 뒤지지 않기 위해서 노력했다. 공부도 더 했고, 운동도 더 했다. 그 애가 책을 좋아한다는걸 듣고 다니지도 않던 서점이나 도서관에 가서 이것저것 닥치는 대로 읽기도 했다. 그 애를 닮고싶기도 했고 그 애보다 뒤쳐지기 싫어서 시작한 것들이 내 자신을 가꾸게 된 계기가 되었다. 그렇게 성적이 올랐고 키도 컸다. 대학 또한 그 아이보다 상위 학교로 진학했다. 그 아이와는 학교문제로 멀어지면서 메일이나 메신저로 간간히 연락하며 지냈다. 결국 잘 안되긴 했지만 그 아이 덕분에 내가 모든 방면에서 성숙해졌다고 느꼈다. 예전처럼 남들의 눈을 의식하는 것도 사라졌다. 남의 눈을 신경쓰지 않고 내가 갈망하는 것들을 하다보니 자연스레 사라진 것이다. 그와 더불어 자신감 또한 생겼다. 하면 된다는 생각이 머리속에 자리잡았다. 어린 마음에 뭣도 모르고 시작했던게, 이제는 내가 원하는 것을 찾고 그걸 행동으로 옮긴 뒤 결과를 받아들이며 남들과 비교하지 않고 내 스스로에게 만족과 행복을 찾기 시작했다. ",3.0
42,43,"학창시절 솔직하고 숨김이 없는 성격 탓에 친구들과의 갈등이 있었고, 그러한 상황이 학창시절의 내가 외롭고, 스트레스를 받게 했던 것 같다. 학창시절 친구들과의 갈등으로 겉돌았기에 그럴때마다 더 핸드폰을 많이 했던 것 같다. 그리고 그때부터 만화책을 보기 시작했던 것 같다. 외로움을 덜 느끼려고.... 그러한 이유때문에 졸업이후에도 친한, 깊은관계의 친구들이 손에 꼽을 정도이고 내가 급하거나 필요할때 연락을 했을 때 나와 줄 친구가 몇 명이나 있을까라는 생각을 하게 하고, 친구관계나 인간관계에 대한 자신감 낮추기에 충분했던 것 같다. 나는 사람과 어울리는 것을 좋아하고 노는 것을 좋아하는데, 만날 수 있는 친구가 한정적이기에 더 안타까운 것 같다. 인간관계에서 자신감이 낮아지다보니 자존감 또한 한없이 내려가서 자격지심이 심한 것 같다. 또한 자존감이 낮기때문에 좀더 자기계발에 힘쓸려고 노력하는 것 같다.  그리고 자존감이 낮기에 나를 공개하고 주목을 받는거에 대해서 두려움을 가지고 있는 것 같다.  여태까지 살아온 세월 중 거진 절반이 학창시절이기에 아직은 나에게 큰 영향을 미치는 것 같다.  ",2.0
