68,69,"본인은 중학교 학창시철까지는 솔직하고 자유분방하며, 독립적이고 개인주의적인 스타일이었음. 형제가 많은 대가족의 구성원이었지만 남자 형제들 중 막내여서 아버지의 사랑을 많이 받았음. 특히, 아버지는 어머니와 달리 자식들과의 스킨쉽이 많고 사랑을 자식으로서 사랑받고 있다는 느낌을 주신 분임.  반면, 사회활동이 비교적 많았던 어머니로부터 학창시절 캐어를 받다보니 다른 친구들보다 어머니에 대한 사랑이 부족하다고 생각했음. 막내였고, 형제가 많았던 이러한 가정환경적인 측면으로 인하여 친구들과의 교유관계가 더욱 친밀해지고 개인주의적인 성향도 두드러졌던 것 같음.   그러나 고등학교 학창시절 이후에는 매우 소극적이고 자신감이 부족해 꿈꾸는 청소년 시절을 보내지 못했음. 그 이유는 중학교 학창시절에 사귀었던 친구들과의 지나칠 정도로의 유대관계로 인하여 고등학교 학창시절 공부보다는 탈선을 일삼아 왔기 때문에 본인 스스로를 루져라 생각하며 자신감 없이 군입대를 했었음.  군 제대 이후 지금의 성격과 스타일이 유지되어 오고 있음.  본인의 성격에 가장 크게 영향을 끼친 첫번째 사람은 형제 중 바로 위의 형이었음. 형은 앞으로 본인에게 맞닥뜨리는 모든 사안을 씩씩하고 현명하게 대처해야 한다는 당위성과 함께 방법을 가르쳐 주었고 특별한 용기를 심어주었음. 그래서 매사 귀찮거나 신경쓰이는 사안들이 생길때마다 부딪혀 해결하려는 습관이 생긴것임. 두번째 사람은 직장생활의 보스였음. 마찬가지로 업무를 해결함에 있어서 진취적으로 직접 확인하고 부디쳐보고 협업을 통해 해결할 수 있는 훈련을 받았음.",1.0
69,70,"취직 시험에 대한 반복된 실패를 겪었으나 포기하지 않았던 경험. 사실 살아오면서 실패로 인해 나의 가치가 흔들린다거나 나의 중심이 흔들리는 경험을 못 하고  나 자신에 대한 믿음과 자신이 있는 상태로 살아온 것 같다 하지만 20대 중후반 취직을 준비하는 과정에서 시험응시의 2번의 실패에 이은 최종시험에서의 2번에서의 실패를 연이어 겪었을 땐  나 자신이 나자신에 대한 자신이 없어지고 절망하는 경험을 한 것 같다. 이대로 가도되나, 이길이 맞나, 나는 붙을 능력이 있는 사람인가 하는 끝없는 불안. 남들은 몰라도 나는 할 수 있어라는 생각으로 살아왔지만 이 경험으로 나의 삶이 송두리채 흔들리는 경험을 한 것 같다 그리고 오개념도 생겨났다. 마치 이 시험에 통과하기 전까지는 나는 무가치하고  행복해지지 못할 것 같다라는 생각에 힘들었다. 한동안 힘들어만 하다보니 맘속에서 나도 모르게 시험이 안되도 된다. 아깝게 떨어졌으니 다음에 치면 되겠지. 지금 우리 가족 모두 건강하게 옆에 있는 것 만으로도 나는 행복하다 라는 생각으로 ""살아가기 위한 긍정""을 하며 시간을 보냈다. 그렇게 시간을 보내다보니 시험도 포기하지 않은 채로 한번 더 쳤더니 거짓말처럼 합격을 하게 되었다. 그런데 합격을 하게 되어도 또 다른 고민이 생기고 또 다른 고민이 생기더라. 하지만 취직 준비할 때처럼 나를 벼랑 끝으로 내몰지는 않게되었다. 조금 더 쉬어가며 나자신의 편을들어주고 어르고 달래며 일을 처리하는 태도를 갖게 되었고 취직이 이제 되었으니 나자신의 모습, 인격을 돌아보는 여유있는 시간을 더 갖게되었다. 나 혼자만의 경험이지만 이 일을 겪을 때 취직을 준비하며 힘들었던 시기에 옆에 있어준 가족들 친구들에 대한 고마움을 잊지 못하고 갚아나갈 것이고 나도 그들에게 힘들 때 옆에 있는, 그리고 좋은 일이 있을때 함께 축하할 수 있는 사람으로 옆에 남고 싶다. 이 실패와 성공의 경험은 앞으로 남은 나의 생에도 영향을 많이 줄 것 같다. 찰나의 성공의 순간보다 반복된 취직 시험과 면접시험에서의 실패가  몇번 실패해도 몇번 더 포기하지 않고 해보는 끈기를 가져다 준 것 같고 한번에 성공하는 것보다 나자신을 몸소 겸손하게 만들고 성숙하게 되는 계기가 된 것 같다.",3.0
70,71," 내 인생을 돌이켜 보면 커가면서 계속 성격이나 성향, 사고의 방향등이 수정되고 바뀌긴 했지만 성인이 되어서 결정적 영향을 미친 것은 2015년 가을부터 영국으로 3개월간 파견을 가게 된 경험에 있는 것 같다.   우리나라의 경쟁적인 체제 속에서 소위 말하는 모범생으로 주변의 시선과 부모의 기대 등에서 자유롭지 못했던 너무나 당연하게 느껴졌던 나의 삶의 태도에 비추어 봤을 때,  삶의 질과 개성있는 삶, 가치있는 삶을 좀 더 자유롭게 추구하는 유럽인들의 생활 태도를 보며 무엇이 더 가치있는 삶인지에 대한 고민을 시작하게 된 것 같다.   처음엔 그들과 비교했을 때 내 인생은 너무 평범하고, 아무런 인생에 대한 고민과 고찰 없이 흘러온 무의미한 인생이었나 하는 회의감이 느껴졌다. 하지만 우리나라 사회에서 비교적 안정적인 직업으로 생활하고 있는 감사함도 무시할 수는 없다는 생각이 들었다. 물론 한국 사회에서 내가 갖고 있는 모든 역할을 다 벗어던지고 떠날 수는 없지만, 어느 정도 일에 집중하면서도 내 생활을 되돌아보고 내가 더 가치있고 행복하게 살 수 있도록 노력하는 방법을 고민해보기 시작했고 일과 균형있는 여가생활로 예전에 비해 스트레스를 덜 받고, 일에서 오는 힘든 점도 좀 더 유연하게 처리할 수 있게 된 것 같다.   그 경험 이후 나는 일과 나의 삶에서 오는 균형에서 행복감을 크게 느끼는 사람이라는 것을 알게 되었고 그 균형을 잘 맞추기 위해 내 여가생활(여행, 운동 등)에 적절히 투자하며 살고 있다. ",0.0
71,72,"7년 전 미국으로 6개월 간 교환학생을 갔을 때 나 자신이 많이 바꼈다. 그 전에는 사교적이고 인맥 쌓기를 좋아해서 깊은 관계는 아니지만 친구가 많았고 새로운 경험을 좋아했다. 하지만 미국에 교환학생 생활을 하며 나를 아무도 모르는 곳에서 혼자가 되었고, 내가 사실은 굉장히 내성적인 사람이란 걸 깨닫게 되었다. 누군가와 함께 있는 것보다 나 혼자만의 시간을 즐기는 사람이라는 걸 뒤늦게 알게 된 것이다. 그렇게 거의 혼자 6개월을 생활하면서 인간 관계에 대해서도 많은 생각을 하게 되었고, 정말 친한 친구들이 누구인지, 그들에게 나는 어떤 존재인지도 알 수 있었다.  뿐만 아니라 같이 교환학생을 온 언니가 교통사고로 한 순간에 거의 식물인간이 되면서 인생에서 중요한 게 무엇인지 곰곰이 생각하게 되었다. 당시 나는 학점에 굉장히 신경쓰며 스트레스 받고 있었는데 이렇게 스트레스 받으며 높은 학점을 받는 게 내 인생에서 중요한 일인지 고민하게 되었다. 그 이후로 나는 어느 정도 내가 만족할 만한 수준에서 학점을 유지하며 하루하루 즐겁게 사는 데 집중했다. 또한 미국의 시골에서 잠깐 홈스테이 생활을 하며 비록 직업이 화려하지 않고 변변치 못한 살림이지만 알콩달콩 예쁘게 살 수 있다는 점도 깨달았다. (사실 이 생각은 3~4년 후에 주변 친구들과 비교하게 되면서 경제적인 능력도 어쩔 수 없이 중요하다라고 바뀌게 되었다.) 미국에서의 6개월 간의 경험이 아니었다면 21살의 어렸던 내가 인맥 쌓기와 학점을 올리는 데 집중하느라 나 자신과 내 삶에 대해 진지하게 고민하지 않았을 것이다.",3.0
72,73,"현재의 내 모습은 타인 보다 많이 뛰어나진 않지만 내가 있는 그 위치에서 타인들로부터 인정을 받고 그것들을 성취해오는 상태에서 큰 만족을 느끼며 살아왔던 것 같다. 초등학교 때 이후 부터 발현되는 학업적 성취에 대한 강한 성취욕이 있었다.  친구들과도 곧 잘 어울리는 편이었고 굉장히 사교적이었다. 그 90년대 당시에는 학급 반장, 부반장을  매 학기 마다 선출하였는데 초등학교 3학년 때 반장선거에서 떨어졌고, 그중 가장 친한 내친구가 반장에 당선되었다. 성취욕과 사람들로부터 인정받고 싶었던 마음이 컸던 나는 가장 친한 친구의 당선을 축하해줬지만, 사실 속상하고 그 경험이 잊을 수 없는 경험으로 남았던 것 같다. 그 때 부터 내 목표는 내가 이룰 수 있는 것은 꼭 이루자! 이렇게 마음을 먹는 결정적인 계기가 되었다. 모든일에는 항상 나보다 뛰어난 사람이 있었고 그 사람들을 이기고 성적을 올리는 그 자체와 타인들로 부터 받는 칭찬이 상당히 기분이 좋았었다. 하지만 그러한 면과 동시에 나에게는 타인들과 협력하고 그 과정을 좋아하는 면이 있는데, 그 상황에서 큰 역할갈등을 느끼면서 자랐다. 어떤일에는 혼자해야 잘 되는 일이 있고 협력을 하고 이야기를 해서 풀어나가야 잘되는 일들이 있어왔다. 그 갈등 과정에서 나는 항상 자의반 타의반 리더의 역할에 서게 되는 일들이 많았고, 중고등학교 때에는 선생님께 친구들 사이에서 중재자 역할을 잘 해낸다는 소리를 곧 잘 들어왔었다. 하지만 이러한 상황에 놓이게 되면서 어느 누구 편도 들 수 없는 상황이 생겼을 때 양쪽의 의견을 잘 들어주는 이면에는 나 혼자만 알고 있는 그 집단의 비밀 등을 알게 되면서 혼자서 끙끙 앓게 되는 사건들을 자주 발생되었다. 그래서 알게 모르게 다른 사람의 입장을 생각하게 되고, 누군가가 나때문에 상처를 받지 않아야 한다는 생각이 머리 속에 자리 잡게 되었고, 그 생각은 고등학교 때 많이 강화가 되었던 것 같다. 나는 끊임없이 변화하고 발전하는 존재라 생각한다. 아직도 목표를 달성하는 것에 큰 만족을 느끼는 반면 또 지극히 누군가와의 갈등과 경쟁의 상황에 놓이는 것을 싫어한다. 참으로 양면적이다. 한편으론 나를 돌아보면서 나에게 그 성취욕 마저 없었다면 지금 이 자리까지 오지 못했을 것이라 생각한다. 억지로 어떤 성격을 강화하고 억제한다기 보다는 매 순간 놓여지는 상황에서 내가 더 강점으로 발휘할 수 있는 성격을 극대화시켜 앞으로 그 순간들을 즐기며 살아가려 한다. 주변의 친구들과 좋은 동료들은 늘 나에게 좋은 자극을 주는 활력소이며, 나도 누군가에게 그러한 존재가 되었으면 좋겠다. ",0.0
73,74,"나는 사실 굉장히 긍정적이고 낙천적인 사람이다. 지금까지도 그 성향이 남아있지만 큰 사건으로 인해서 나는 남을 조금 의심하기도 하고, 꼼꼼하게 체크하고 신중한 마음을 가진 경험이 있다. 24살때 영국에 계신 이모네 댁으로 놀러간 적이 있었다. 6개월 간의 비행기 표를 끊어갔다. 웨일즈에 있는 카디프 공항에 도착하여서 입국 심사를 받는데 나에게 리턴티켓이 있냐고 물었다. 그래서 나는 물론 있다면서 보여주었다. 그랬더니 입국심사관이 얼마를 가지고 있냐고 물었다. 사실 나는 이모네 집에서 지낼 계획이라 큰 돈을 가지고 있지 않았다. 솔직하게 20파운드 정도 가지고 있다고 했더니 입국심사관을 고개를 갸우뚱 하며 잠깐 옆에서 기다리라고 했다. 그런데 영국으로 출발하기 전 이모가 입국 심사가 매우 까다롭다고 대답을 잘 해야한다고 말했다. 혹시 잘못되면 입국이 안될수도 있다고 신중하라고 이야기해주었다. 그런데 나는 그 말을 크게 귀담아듣지 않고 대충 흘려들었다.  그 뒤 입국 심사관은 나를 작은 방으로 데려가서 이것저것 묻기 시작했다. 영국에서는 뭘 할건지, 이모네 가족은 왜 여기 있는건지, 너는 왜이렇게 긴 시간(6개월)동안 여기에 온건지 등등.. 한국에서 부모님은 뭘 하는지 나는 그동안 한국에서 뭘 했는지에 대하여 물었다. 사실 처음에는 영어가 들려서 신기해서 내 마음대로 대답한것도 있었다. 대충 대답을 마친 뒤 입국심사관은 나를 데려가서 내 짐을 찾게 하고 짐을 검사하였다. 짐 안에는 이모네 가족에게 줄 반찬들이 있었는데 고기 등을 보면서 이것은 불법이라고 이야기 하였다. 나는 그때까지만 해도 짐은 다 버리고 나만 들어가겠구나 라고 생각했는데 상황은 정 반대로 돌아갔다. 짐과 함께 나를 영국에 하루를 머무를수있겠다고 해주었다. 아마 나를 불법체류할것으로 생각했던것같다. 동양의 작은 나라에서, 돈도 별로 가지고 있지도 않고 그때 나는 휴학생이었기때문에 나를 보장해줄수있는 신분도 없었던 터였다. 그래서 결국 나는 이모댁에 하루밤을 자고 다음날 귀국비행기로 한국에 돌아오게되었다. 한국에 돌아오고 나서 나는 너무 억울했지만 나의 행실에 대하여 다시 생각하게 되었다.  침착하지 못했던 점, 또 경계없이 아무말이나 대답한 점(내 생각에는 제대로 했다고 생각했지만 완벽하지 않았던 영어가 서로에게 오해를 더욱 불러왔던것 같다), 입국 심사 당시에도 큰 걱정을 하지 않았던 점 등.. 나의 긍정적이고 낙천적인 성격이 큰 화를 불러왔던것같다. 그 뒤로 나는 여전히 긍정적이고 낙천적이지만 신중해야 할 부분을 구별하게 될 수 있게된것같다.",0.0
74,75,"시골의 가난한 농부집에서 태어나서 서울에 있는 실업계 고등학교를 졸업한 것이 나의 인생을 바꾸었습니다,. 시골 부보님들의 소망은 아들이 학교를 졸업하여 취직하는 것이죠. 어떤 직장이나 어떤 꿈을 실현하느냐에는 관심이 없었고 그럴 형편도 되지 못했지요.  공식적으로 대학진학이 불가능한 실업계 고등학교였기에, 그리고 나름대로 시골 학생들이 자질은 좋은 학생들이었기에 서울에서의 청소년을 보내면서 많은 갈등과 방황하는 시기를 지났습니다. 그러나 대학진학시기가 가까워오자 여타 인문계 고등학교 학생들과 자신을 비교하게 됙고 낙담하게 되었으나 몇몇 선생님들의 사랑과 격려(너희들이 정말 공부하기를 원한다면, 그리고 계속 노력한다면 반드시 좋은 결과를 가질 수 있다라고, 환경을 원망하지 말라고)가 오늘의 우리들을 만들었습니다.  야간대학을 가고, 직장에서도 제도나 시스템에 반박하기 보다는 수용하고 주어진 환경에서 부족하고 능력이 뛰어나지 못했지만 나름 성실하게 보냈기에 무난한 인생을 살아 온듯 합니다.때로는 주위사람들로부터 대단하다는 소리를 들어가면서,...  주어진 여건에서 방법을 찾아 노력했고, 승진이나 어떤 기회가 있을 때 배경이나 권력을 이용하여 편법을 쓰지 못했으나 바른 길로 갔다고 봅니다. 그리기에 가는 길이 늦었지만 나름 보람을 느끼고 성취감을 맛볼 수 있었습니다. 따라서 가족들에게도 자랑스런 아빠가 될 수 있었던 것 같습니다.   이러한 상황에서 신앙생활을 하면서 조금씩 깨닫고 영글어 가는 듯합니다. 나이가 들면서는 더욱 참된 삶의 모습을 찾으려고 노력하는 평범하지만 의미있는 삶을 살아간다고 보아야 겠지요.",4.0
75,76,"현재 나의 모습에 이르게 된 결정적인 경험.... 이거는 하나로 꼽긴 어렵다. 20대에... 나에겐 인생 조언을 해줄 어른이 없었고 하고자 하는 일에 정보가 부족했다. 그냥 뜬구름마냥 꿈만 꿀 뿐이고 내가 원하면 별 노력없이도 뭐든 쉽게 될 수 있을 거 같았다. 가지고 있던 재능이나 부모님의 뒷받침에도 불구하고 20대의 나는 허송세월을 보내고 내 인생을 열심히 살지 않았다. 그에 대한 죄의식이 지금까지도 있는 거 같다. 현재 내가 이룬 직업, 가정 등 나도 만족하고 부모님도 만족하시지만 내가 헛되이 보낸(정말 노력을 하지 않았었다..) 시간에 대한 죄책감이 지금도 있다. 그래서 그 보상심리(?)인지는 모르겠지만 지금의 나는 꽤나 약아지고 더이상 순진하지만은 않고 모든 일을 도전함에 있어서 정보가 얼마나 중요한지를 깨달아 어떤 일을 시작하기 전에 최대한 많은 정보를 얻으려고 노력한다. 결국에는 내가 원하는 꿈(?)을 이루긴 했지만...조금 멀리 돌아왔다는 것... 부모님의 기대에 미치지 못하고 치열하게 살지 못했던 이 시기가 참 속상하지만 그만큼 지금 더 열심히 살려고 노력중이다. 이런 경험들은 현재의 나를 성장지향적인 인간, 계획을 잘 세우는 인간, 목적의식을 가지고 사는 인간으로 만들어 주었다. 20대때 나의 인간관계에서는 나는 너무나 순진했고 모든 사람들이 나처럼 선한 의도를 가졌다고 생각을 했던 거 같다. 그래서 믿었던 사람에게  혹은 상사에게 배신을 당하고 혼자 큰 상처를 받곤 했다. 지금 생각해도 많이 씁쓸한 것을 보면 그 기억이 나에게는 꽤나 슬펐던 거 같다. 아직도 사람들은 나의 이미지가 아이같다고 하지만... 이제는 예전같이 순진하게만은 사람들에게 다가가지 않는다. 약간의 의심도 생기고 조금 더 그 사람의 행동 이면을 생각하게 된 거 같다. ",2.0
76,77,"1. 유년시절부터 봐왔던 큰아버지와 아버지와 불화  - 사업 실패 이후 큰아버지 회사에서 성실하게 일하셨던 아버지는 회사의 모든 관리와 경영을 해오셨다. 실질적인 경영과 수고에도 불구하고 말도 안되는 임금을 받아왔다. (생계를 위해 어머니와 함께 큰아버지 회사를 다녔는데 두분의 임금의 합이 한사람의 몫에 지나지 않는 터무니없는 월급을 받아왔다고 한다.) 그럼에도 친척들 앞에서 아버지를 무시하고 으스대는 행동에 분노의 감정이 생겨났다.  그래서 사촌 형들보다 더 잘되야겠다는 마음, 나는 커서 저런 오너가 되지 말아야지, 내가 사랑하는 가족들을 지켜야지 하는 감정들이 생긴것 같다.    2. 고등학교 시절 친한 친구와의 다툼, 무리에서 배제됨  - 친구들 사이에서 유쾌하고 밝은 성격이라는 소리를 자주 들어왔다. 친하게 지내는 무리가 여러명 있었는데 가장 친하게 지내는 친구와 사소한 말다툼으로 멀어지게 되었다. 지금 생각해보면 그저 잠깐 토라진 것이었는데 이런 경험이 처음있던 터라 친구를 잃었다는 상실감이 너무 컸다. 또 오해가 더해져 친하게 지내던 친구들 무리에서 떨어져 나오게 되었다. 소문은 삽시간에 더 이상하게 퍼져서 다른 반 친구들도 나에 대해 안좋은 시선과 태도를 갖게 되었다. 학교에 더 오래 있기 싫었다. 그래서 학교 수업을 빨리 마치고 도망갈 수 있는 방법이 무엇이 있을까 생각하다가 예체능 계열로 진로를 선택하는 것이었다. 그러면 정규 수업까지만 듣고 빨리 학교를 빠져나가 학원을 갈 수가 있었기 때문이다.  친구에게 화해의 제스쳐를 취해보았으나 그것마저 조롱의 소제로 삼는것에 충격을 받았던 나는 그렇게 다툼과 갈등에 대해 도망치게 되버렸다. 그러나 교회를 다니면서 관계에 대한 회복과 나 자신에 대한 성찰의 시간을 가지며 나의 어떠한 행동과 말을 상대는 그대로 받아들이지 않고 오해하고 다르게 볼 수 있겠구나 라는 생각을 하게 되었다.  처음에는 내 의도와 상관없이 해석하는 상대에 대해 무지하고 잘못된 시선을 가졌다라고 비판했지만 최근 들어서는 그럴수도있겠다, 그 사람 입장에서는 그럴 수 있지 뭐, 라고 생각하게 된 것 같다. 그런 생각이 들면서 너무 감정으로 업되었을 때나 친한 사이에서 편하게 할 수 있는 말과 행동들에 경계하고 신중하게 하는 습관이 생긴것 같다. 차분하다는 이야기를 많이 듣는 이유는 말과 행동을 신중히 함으로써 사랑하는 사람을 잃고 싶지 않은 마음이 겉으로 표현되는 것 같다.   ",3.0
77,78, 나는 내 자신을 바라볼 때 앞만 보고 달리는 성격이다. 두루드루 여러가지 일을 하지 못하고 내가 맡은 임무만 집중해서 앞만 보고 달리는 성격이다. 그래서인지 월급을 받아도 재테크가 뭔지도 모르고 나에게 주어진 것을 만족하게 쓰고 행복해 했었다.  나이가 조금 먹어가니 결혼도 해야하고 모아둔 돈도 없었다. 나에게 부족한 이 우유부단하고 경제적 감각이 없는 나를 보충해줄 야무진 여자가 매력적으로 보였다.  그래서인지 지금의 아내는 그 조건을 딱 맞춘 아내이다. 아내가 있어서 나는 내 일에 집중하며 일을 할 수 있었고 잡다하게 생각해야 하는 아이들의 교육문제나 재테크 이런 머리아픈 일로 부터 자유로울 수 있었다. 일에 집중하니 승진도 남보다 빨랐고 일에 재미가 있었다.지금도 직장에서 열심히 일하고 나에게 주어진 용돈과 주말에 골프를 치며 스트레스를 풀 수 있는 것이 넘 행복하다. 아내는 내가 재테크나 가정의 일에 조금 관심을 가져줬으면 하나 난 그런 일에 너무 관심이 없고 가계부를 보라고 할 때도 건성으로 알았어~ 알았어~만 대답한다. 경제를 모두 아내에게 맡기다 보니 우리집 재산이 얼마인지 빚이 있는지 알지도 못한다. 이러다 이혼당하면 어쩔거냐고 주위에서는 말하지만 난 여전히 아내를 믿고 있고 앞으로도 알아서 아내가 더 많은 재산으로 불려주기만을 바라고 있다. 대신 나는 직장생활은 철저히 하고 있다. 직장에서 인정 받고 몰두하는게 나는 더 재밌고 보람차다. 그것이 비록 스트레스일지라도..대신 스트레스때문에 나는 담배와 술을 많이 한다.내 일에 집중하고 일할 수 있게 만들어준 아내와의 만남이 내인생의 가장 중요하고도 결정적인 사건이다.,1.0
78,79," 저는 학창시절 자신감이 없고 소극적이며 조용한 아이였습니다.  그러던 제가 고교시절 친한 친구의 제안으로 한 동아리에 가입하게 되었고, 다른 학생들과 함께 단체활동에 참여하는 일이 많아 졌습니다. 처음 1학년때는 선배들의 부름에 불려다니고 행사가 있을때는 매일 매일 단체생활을 하다보니, 개인 시간도 줄고, 반 친구들과 어울릴수 있는 시간도 상대적으로 적어져서 힘들고, 학교수업도 따라가기 벅찼습니다. 그러다 보니 원래는 15명이었던 저희 학년멤버들이 힘든 활동때문인지 한명씩 탈퇴를 하기 시작했습니다.  결국 1년의 활동을 마칠때쯤엔 저를 포함해서 3명의 친구만 남았습니다. 다른 친구들이 한명씩 동아리를 떠날때 마다, 나도 떠나야하나. 하는 생각을 수 없이 했었습니다. 나중에는 동아리 활동이 학업에도 영향을 줄 정도로 시간 뺏기가 심해져 부모님도 동아리를 탈퇴하라고 극구 말리셨습니다.   하지만  저는 제 스스로 그 활동하는 것이 즐거웠고 보람찼기 때문에 그만두고 싶지 않았고, 3년간 이 활동을 한다면 얻는 것이 분명 있을 것이라 믿으며 버텼습니다. 동기들과도 불안한 마음을 점심시간에 토로하며 서로 위로하며 힘이 되어주었습니다. 그리고 1년이 끝났을때 선배들의 투표로 제가 학년 대표를 맡게 되었고, 함께 협력하면서 리더십도 기르게 되었습니다. 소극적이었던 성격도 밝고 자신감있는 모습으로 바뀌었고, 제 역할을 해나감에 따라 무엇인가를 이뤄낼수있는 성취감도 많이 느꼈습니다.  행사때마다 대표로 앞에나가 무대에 서는 값진 경험도 할 수 있었고, 그 경험들은 고스란히 제가 꿈을 이룰 수 있는 발판이 되어주었습니다.  아직도 저희 3명의 친구들은  서로 소식을 전하며 연락하고 있습니다. 힘든 동아리 활동이었지만 그 과정속에서 어디가서도 찾을 수 없는 멋진 친구들과  값진 경험들을 배울 수 있었습니다. 아직도 저는 그 시절을 떠올리면 힘들긴 하지만, 중간에 그만두지 않은 제자신에게 잘했다고 칭찬해주고 싶습니다.  ",2.0
